"team .colname","total .colname","attack .colname","defense .colname","n .colname","region .colname","city .colname","fall.league .colname","spr.league .colname","other .colname"
"Crossfire Premier ECNL G05",1752,22.71,32.23,24,"WA","Redmond","RCL G05 Div 1","ECNL U13",""
"Crossfire OR United ECNL G05",1664,26.96,14.84,10,"OR","","","ECNL U13","FWRL NW G05"
"FC Nova ECNL G05",1536,19.87,8.24,11,"ID","Boise","Idaho D3 Div 1 U14","",""
"Seattle United Copa G05",1496,11.52,10.8,17,"WA","Seattle","RCL G05 Div 1","","FWRL NW G05"
"GS Surf A G05",1483,7.24,15.72,25,"WA","Bothel","RCL G05 Div 1","",""
"ISC Gunners A G05",1471,10.09,10.37,33,"WA","Issaquah","PSPL WNPL U13","",""
"FC Portland ECNL G05",1445,7.01,12.49,22,"OR","Portland","PTT G05 Premier Red","ECNL U13","FWRL NW G05"
"Eastside FC Reign G05",1440,11.44,7.39,23,"WA","Preston","RCL G05 Div 1","","FWRL NW G05"
"WPFC ECNL G05",1421,9.63,7.67,27,"WA","Tacoma","RCL G05 Div 1","ECNL U13","FWRL NW G05"
"Snohomish United Black G05",1407,11.49,5.85,30,"WA","Snohomish","RCL G05 Div 1","","FWRL NW G05"
"NEU White G05",1368,7.34,7.01,28,"OR","Portland","PTT G05 Premier Red","","FWRL NW G05"
"Idaho Rush Premier G05",1367,6.17,8.26,9,"ID","Boise","","","FWRL NW G05"
"PacNW Maroon G05",1328,5.19,7.49,25,"WA","Tukwila","RCL G05 Div 2","",""
"Crossfire Premier B G05",1327,7.59,5.07,28,"WA","Redmond","RCL G05 Div 2","",""
"FC Edmonds Quiet Riot G05",1295,4.34,7.11,32,"WA","Edmonds","PSPL WNPL U13","",""
"ETFC Chelsea Black G05",1260,6.32,3.83,20,"OR","Eugene","PTT G05 Premier Red","",""
"RV Slammers Orange G05",1251,4.41,5.18,18,"WA","Auburn","RCL G05 Div 2","",""
"THUSC Neon Black G05",1245,4.96,4.42,29,"OR","Tualatin Hills","PTT G05 Premier Red","","FWRL NW G05"
"Crossfire Premier C G05",1239,3.82,5.49,32,"WA","Redmond","RCL G05 Div 2","",""
"Indie Chicas Lime G05",1235,4.81,4.23,15,"ID","Eagle","Idaho D3 Div 1 U14","",""
"Washington Timbers Red 1 G05",1232,3.62,5.53,20,"WA","Vancouver","PTT G05 Premier Red","",""
"PCU Red 1 G05",1226,4.88,3.92,27,"OR","Portland","PTT G05 Premier Red","",""
"WA Rush G05",1209,4.22,4.04,24,"WA","Everett","RCL G05 Div 1","",""
"Spokane Sounders A G05",1203,4.29,3.8,25,"WA","Spokane","RCL G05 Div 1","",""
"ASE Emerald G05",1193,7.05,2.17,22,"WA","Pasco","PSPL WNPL U13","",""
"BSC Portland Black G05",1187,2.69,5.46,25,"OR","Portland","PTT G05 Premier White","",""
"Seattle United Tango G05",1177,4.85,2.82,24,"WA","Seattle","RCL G05 Div 2","",""
"Harbor Premier Green G05",1166,3.76,3.36,22,"WA","Gig Harbor","RCL G05 Div 2","",""
"Canyon Optimist Inferno G05",1164,4.89,2.55,14,"ID","","Idaho D3 Div 2 U13","",""
"Eastside FC White G05",1160,3.68,3.3,33,"WA","Preston","RCL G05 Div 2","",""
"Seattle Celtic Green G05",1159,3.97,3.02,20,"WA","Seattle","PSPL WNPL U13","",""
"WUFC Gold G05",1150,2.24,5.05,24,"OR","West Linn","PTT G05 Premier White","",""
"Bellevue United Blue Angels G05",1148,2.88,3.88,22,"WA","Bellevue","NPSL Div 1 (05) U13","","Founders Cup G05 Div A"
"Cascade Rush Clash G05",1138,4.86,2.14,17,"OR","","PTT G04 Premier White","",""
"Whatcom FC Rangers Gold G05",1136,4.29,2.39,22,"WA","Bellingham","RCL G05 Div 1","",""
"MVP Marauders Navy G05",1118,4.1,2.21,16,"WA","Maple Valley","PSPL WNPL U13","",""
"Real Boise CF Malaga Fire G05",1101,3.94,2.04,14,"ID","","Idaho D3 Div 2 U13","",""
"Idaho Rush Nero G05",1096,3.36,2.32,14,"ID","Boise","Idaho D3 Div 2 U13","",""
"Dragons FC G05",1096,4.32,1.81,34,"WA","Seattle","PSPL WSPL 1 U13","",""
"Crossfire OR LOSC Blue I G05",1091,3.91,1.93,27,"OR","Lake Oswego","PTT G05 Premier White","",""
"Rogue Valley Timbers Red G05",1087,3.71,1.97,16,"OR","Medford","PTT G05 Premier Red","",""
"Washington Timbers Red 2 G05",1079,3.02,2.29,29,"WA","Vancouver","PTT G05 Div 1 Red SE","","OYS Presidents Cup G05"
"PacNW Blue G05",1073,2.87,2.32,29,"WA","Tukwila","RCL G05 Div 3","",""
"Capital FC Timbers Red G05",1072,2.82,2.34,20,"OR","Salem","PTT G05 Premier Red","",""
"Seattle United Samba G05",1071,2.71,2.41,29,"WA","Seattle","RCL G05 Div 3","",""
"TC United Navy G05",1058,2.29,2.61,16,"WA","Lacey","PSPL WSPL 1 U13","",""
"CWSA Navy G05",1058,2.39,2.49,14,"WA","Yakima","PSPL WSPL 1 U13","",""
"GS Surf B G05",1053,2.35,2.44,27,"WA","Bothel","RCL G05 Div 2","",""
"FC Nova Gold MZ G05",1051,3,1.9,18,"ID","Boise","Idaho D3 Div 2 U13","",""
"Three Rivers SC Black G05",1038,2.81,1.85,20,"WA","Pasco","RCL G05 Div 3","",""
"Crossfire OR SSC Blue I G05",1037,2.7,1.91,27,"OR","Tigard","PTT G05 Premier White","",""
"WPFC Black G05",1024,2.49,1.89,30,"WA","Tacoma","RCL G05 Div 2","",""
"Wenatchee Valley United Aguiltas G05",1000,2.49,1.61,10,"WA","Wenatchee","PSPL WSPL 1 U13","",""
"FWFC Blue G05",992,2.37,1.6,28,"WA","Federal Way","RCL G05 Div 3","",""
"Westside Timbers Copa TS G05",987,1.61,2.27,32,"OR","Beaverton","PTT G05 Premier White","",""
"FC Portland White G05",984,2.39,1.49,25,"OR","Portland","PTT G05 Div 1 Red NW","","OYS Presidents Cup G05"
"Breakers Black G05",984,2.02,1.77,14,"WA","Spokane","PSPL WSPL 2 U13","",""
"Boise Nationals Timbers Blue G05",983,2.6,1.36,8,"ID","Boise","Idaho D3 Div 2 U14","",""
"FPSC Fury Black G05",969,2.95,1.09,23,"WA","Tacoma","PSPL WNPL U13","",""
"NC Alliance FC G05",957,2.17,1.37,19,"WA","","PSPL WSPL 1 U13","",""
"IDA-ORE FC Tigers Ontario G05",952,3.02,0.95,9,"ID","","Idaho D3 Div 2 U13","",""
"Wenatchee Valley United G05",945,1.69,1.62,21,"WA","Wenatchee","PSPL WSPL 1 U13","",""
"Seattle Celtic White G05",944,1.68,1.62,18,"WA","Seattle","PSPL Classic 1 - West U13","",""
"Bend FC Timbers Red G05",944,3.35,0.81,21,"OR","Bend","PTT G05 Premier White","",""
"Pacific FC Panthers G05",938,2.05,1.27,24,"WA","Battleground","PTT G05 Div 1 Red SE","","OYS Presidents Cup G05"
"Hells Canyon FC G05",937,1.86,1.4,10,"ID","","PSPL Classic 1 - East U13","",""
"Crossfire Select Reimbold G05",932,1.91,1.31,26,"WA","Redmond","NPSL Div 1 (05) U13","","Founders Cup G05 Div A"
"ASE Royal G05",931,2.4,1.03,14,"WA","Pasco","PSPL Copa 1 - East U13","",""
"ISC Gunners B G05",919,1.58,1.44,24,"WA","Issaquah","PSPL WSPL 2 U13","",""
"Cheney Storm FC G05",919,1.48,1.55,13,"WA","Cheney","PSPL Classic 1 - East U13","",""
"THUSC Neon Green G05",914,1.64,1.34,23,"OR","Tualatin Hills","PTT G05 Premier White","",""
"Crossfire Select Gold-Jordan G05",907,1.61,1.3,29,"WA","Redmond","NPSL Div 1 (05) U13","","Founders Cup G05 Div A"
"MRFC Blue G05",900,2.34,0.86,25,"WA","Bonney Lake","PSPL Classic 1 - West U13","",""
"Spokane Foxes G05",894,1.36,1.41,17,"WA","Spokane","PSPL Classic 1 - East U13","",""
"CSC Storm Navy G05",885,1.31,1.38,19,"OR","Corvallis","PTT G05 Div 1 Red NW","","OYS Presidents Cup G05"
"WA East G05",874,2.03,0.82,14,"WA","Spokane","PSPL Classic 1 - East U13","",""
"Southlake Select Red G05",865,1.44,1.09,18,"WA","Renton","NPSL Div 2 (05) U13","",""
"BIFC Blue G05",860,1.21,1.26,19,"WA","Bainbridge","NPSL Div 2 (05) U13","","Founders Cup G05 Div A"
"PCU Red 2 G05",860,0.98,1.55,22,"OR","Portland","PTT G05 Div 1 Red NW","","OYS Presidents Cup G05"
"Eastside FC Blue G05",858,1.51,1,24,"WA","Preston","RCL G05 Div 4","",""
"CUSC Fusion G05",857,1.11,1.34,17,"OR","","PTT G05 Div 1 Red SE","","OYS Founders Cup G05"
"Highline Select G05",855,1.08,1.35,27,"WA","Burien","NPSL Div 1 (05) U13","","Founders Cup G05 Div A"
"Emerald City FC Green G05",850,0.94,1.5,18,"WA","Seattle","PSPL WSPL 2 U13","",""
"THUSC Iron G05",839,1.15,1.14,26,"OR","Tualatin Hills","PTT G05 Div 1 Red NW","","OYS Presidents Cup G05"
"Seattle United Shoreline Blue G05",825,1.25,0.95,28,"WA","Seattle","NPSL Div 2 (05) U13","","Founders Cup G05 Div A"
"Nortac Sparta Red G05",823,0.88,1.34,13,"WA","Tacoma","PSPL Classic 1 - West U13","",""
"Sting SC Timbers Red G05",816,1.19,0.94,18,"ID","","PSPL Classic 1 - East U13","",""
"HSC GPS Newberg G05",816,0.91,1.22,13,"OR","Newberg","PTT G05 Premier White","",""
"Spokane Sounders B G05",815,1.39,0.8,21,"WA","Spokane","RCL G05 Div 4","",""
"Blackhills FC Black G05",805,1.11,0.93,24,"WA","Olympia","RCL G05 Div 3","",""
"Kitsap Alliance Red G05",803,0.95,1.07,22,"WA","Silverdale","RCL G05 Div 3","",""
"ETFC Chelsea Red G05",800,1.36,0.74,16,"OR","Eugene","PTT G05 Div 1 Red NW","","OYS Presidents Cup G05"
"Oregon Trails FC Storm G05",787,1.02,0.89,19,"OR","","PTT G05 Div 1 Red SE","","OYS Presidents Cup G05"
"Crossfire OR SSC White G05",774,1,0.83,15,"OR","Tigard","PTT G05 Div 2 Red South","","OYS Presidents Cup G05"
"NEU Blue G05",772,0.81,1.01,20,"OR","Portland","PTT G05 Div 1 Red NW","","OYS Founders Cup G05"
"SGESC Fusion G05",766,1.21,0.66,17,"WA","Graham","PSPL Classic 1 - West U13","",""
"Kent United Green G05",758,0.84,0.89,26,"WA","Kent","NPSL Div 1 (05) U13","","Founders Cup G05 Div A"
"NSC Green Thunder G05",755,0.61,1.2,18,"WA","Woodinvile","NPSL Div 1 (05) U13","","Founders Cup G05 Div A"
"Spokane Foxes Chaos G05",751,1.27,0.56,14,"WA","Spokane","PSPL Copa 1 - East U13","",""
"FC Salmon Creek Nemesis White G05",743,1.19,0.57,18,"WA","Salmon Creek","PTT G05 Div 1 Red SE","","OYS Presidents Cup G05"
"Cascade FC Green G05",739,1.19,0.55,17,"WA","Snoqualmie","PSPL WSPL 2 U13","",""
"THUSC Sodium G05",737,0.93,0.7,18,"OR","Tualatin Hills","PTT G05 Div 1 Red NW","","OYS Founders Cup G05"
"MIFC Crush G05",730,0.97,0.63,19,"WA","Mercer Island","NPSL Div 2 (05) U13","","Founders Cup G05 Div A"
"Storm King G05",728,0.69,0.88,12,"WA","Port Angeles","NPSL Div 2 (05) U13","",""
"Seattle United W Blue G05",723,0.97,0.6,25,"WA","Seattle","NPSL Div 2 (05) U13","","Founders Cup G05 Div A"
"NSC White Reign G05",721,0.55,1.06,21,"WA","Woodinvile","NPSL Div 2 (05) U13","",""
"SSC Shadow United Wanner G05",721,0.78,0.74,22,"WA","Spokane","PSPL Classic 1 - East U13","",""
"Endeavour Soccer Academy G05",716,0.89,0.63,14,"WA","","PSPL WSPL 2 U13","",""
"Valor Maroon Hill G05",712,0.77,0.7,10,"WA","Spokane","PSPL Classic 1 - East U13","",""
"BFC Galaxy G05",711,1.5,0.36,9,"OR","","PTT G05 Div 2 Red South","",""
"FC Portland Red G05",695,0.73,0.66,13,"OR","Portland","PTT G05 Div 2 Red West","","OYS Founders Cup G05"
"Snohomish United Red G05",693,0.74,0.65,33,"WA","Snohomish","RCL G05 Div 4","",""
"Breakers Red Antoniuk G05",692,0.98,0.49,10,"WA","Spokane","PSPL Copa 1 - East U13","",""
"Eastside Timbers Red G05",692,0.69,0.68,23,"OR","Gresham","PTT G05 Div 1 Red SE","","OYS Presidents Cup G05"
"Breakers White G05",688,0.9,0.51,14,"WA","Spokane","PSPL Copa 1 - East U13","",""
"Washington Timbers White 1 G05",684,0.65,0.69,21,"WA","Vancouver","PTT G05 Div 1 Red SE","","OYS Founders Cup G05"
"Whatcom FC Rangers Blue G05",683,0.58,0.77,21,"WA","Bellingham","RCL G05 Div 3","",""
"NW United Black G05",677,0.63,0.67,24,"WA","Burlington","RCL G05 Div 4","",""
"WA Rush Nero G05",676,1.16,0.36,25,"WA","Everett","RCL G05 Div 4","",""
"Wenatchee FC G05",666,0.36,1.09,13,"WA","Wenatchee","PSPL WSPL 2 U13","",""
"Saints G05",665,0.83,0.47,20,"OR","","PTT G05 Div 1 Red NW","","OYS Presidents Cup G05"
"PacNW White G05",663,0.81,0.48,29,"WA","Tukwila","RCL G05 Div 4","",""
"LYS Red G05",662,0.68,0.57,17,"OR","","PTT G05 Div 2 Red West","","OYS Founders Cup G05"
"YCSC Lightning G05",656,0.83,0.45,10,"OR","","PTT G05 Div 2 Red South","",""
"Thelo Fusion G05",649,0.66,0.53,24,"OR","Milwaukie","PTT G05 Div 2 Red South","","OYS Founders Cup G05"
"MVP Marauders White G05",647,0.58,0.6,17,"WA","Maple Valley","PSPL Classic 1 - West U13","",""
"Mukilteo Rush G05",645,0.88,0.39,18,"WA","Mukilteo","NPSL Div 3 (05) U13","","Founders Cup G05 Div A"
"Sky River SC Fierce G05",638,0.43,0.75,22,"WA","Monroe","NPSL Div 2 (05) U13","",""
"Walla Walla United SC G05",636,0.58,0.56,9,"WA","Walla Walla","PSPL Copa 1 - East U13","",""
"Seattle United S Blue G05",594,0.52,0.46,21,"WA","Seattle","NPSL Div 1 (05) U13","","Founders Cup G05 Div A"
"Bend FC Timbers White G05",591,0.61,0.38,19,"OR","Bend","PTT G05 Div 2 Red South","",""
"Crossfire OR LOSC Blue II G05",584,0.57,0.39,22,"OR","Lake Oswego","PTT G05 Div 2 Red South","","OYS Founders Cup G05"
"ISC Gunners Select G05",580,0.36,0.6,14,"WA","Issaquah","PSPL Copa 1 - West U13","",""
"ISC Gunners C G05",576,0.51,0.41,23,"WA","Issaquah","PSPL Copa 1 - West U13","",""
"Pacific FC Fury G05",572,0.62,0.33,19,"WA","Battleground","PTT G05 Div 2 Red West","",""
"BSC Portland Gold G05",567,0.77,0.26,15,"OR","Portland","PTT G05 Div 2 Red West","",""
"FME Fusion G05",565,0.59,0.33,15,"WA","Fife","NPSL Div 3 (05) U13","",""
"NWSC Deception FC G05",557,0.75,0.25,15,"WA","","NPSL Div 3 (05) U13","",""
"Seattle Celtic Orange G05",544,0.74,0.23,13,"WA","Seattle","PSPL Copa 1 - West U13","",""
"Gala FC G05",531,0.37,0.42,19,"WA","Marysville","PSPL Copa 1 - West U13","",""
"Crossfire OR WUSC White G05",527,0.19,0.79,12,"OR","West Linn","PTT G05 Div 2 Red South","","OYS Founders Cup G05"
"Tri-Cities G05",525,0.43,0.35,10,"WA","","PSPL Copa 2 - East U13","",""
"Crossfire Select Batig G05",513,0.56,0.24,20,"WA","Redmond","NPSL Div 3 (05) U13","",""
"LWPFC White Sharks G05",500,0.35,0.36,16,"WA","Redmond","PSPL Classic 1 - West U13","",""
"PCU Black 1 G05",493,0.29,0.41,16,"OR","Portland","PTT G05 Div 2 Red South","",""
"Highline Select B G05",470,0.4,0.26,19,"WA","Burien","NPSL Div 3 (05) U13","","Founders Cup G05 Div A"
"FC Spokane Black Slack G05",450,0.32,0.27,19,"WA","Spokane","PSPL Classic 1 - East U13","",""
"Aloha United SC Black G05",448,0.48,0.18,19,"OR","","PTT G05 Div 2 Red West","","OYS Founders Cup G05"
"David Douglas Banshee G05",437,0.44,0.18,14,"OR","","PTT G05 Div 2 Red South","",""
"Wenatchee Valley United Leavenworth G05",436,0.24,0.33,13,"WA","Leavenworth","PSPL Classic 1 - East U13","",""
"FWFC White G05",425,0.34,0.22,18,"WA","Federal Way","NPSL Div 2 (05) U13","",""
"PCU Black 2 G05",425,0.39,0.19,14,"OR","Portland","PTT G05 Div 2 Red West","","OYS Founders Cup G05"
"Spokane Foxes Willett G05",423,0.27,0.27,13,"WA","Spokane","PSPL Classic 1 - East U13","",""
"SESC Wolves G05",417,0.41,0.17,17,"OR","","PTT G05 Div 2 Red West","","OYS Founders Cup G05"
"MVP Marauders Green G05",402,0.33,0.19,13,"WA","Maple Valley","PSPL Copa 1 - West U13","",""
"SSC Shadow Elite White G05",381,0.35,0.16,14,"WA","Spokane Valley","PSPL Copa 2 - East U13","",""
"THUSC Vanadium G05",360,0.17,0.28,12,"OR","Tualatin Hills","PTT G05 Div 2 Red West","","OYS Founders Cup G05"
"FCC Gold G05",340,0.22,0.19,9,"OR","","PTT G05 Div 2 Red South","",""
"NPSA Titans Navy Mercer Island G05",336,0.34,0.12,10,"WA","Mercer Island","PSPL Copa 1 - West U13","",""
"Newport FC Panthers G05",334,0.18,0.22,18,"WA","Bellevue","NPSL Div 2 (05) U13","","Founders Cup G05 Div A"
"Southlake Select White G05",328,0.16,0.24,12,"WA","Renton","NPSL Div 3 (05) U13","",""
"Seattle Celtic Black G05",326,0.24,0.15,10,"WA","Seattle","PSPL Copa 1 - West U13","",""
"Crossfire Premier D G05",301,0.12,0.25,18,"WA","Redmond","RCL G05 Div 4","",""
"Kent United White G05",267,0.23,0.11,15,"WA","Kent","NPSL Div 3 (05) U13","",""
"Wenatchee Valley United Lady Sounder G05",265,0.24,0.1,10,"WA","Wenatchee","PSPL Copa 2 - East U13","",""
"Cheney Storm FC B G05",180,0.15,0.09,12,"WA","Cheney","PSPL Copa 2 - East U13","",""
"Spokane Scotties Bean G05",152,0.12,0.1,13,"WA","Spokane","PSPL Copa 2 - East U13","",""
"KVJSA Ellensburg FC G05",-150,0.03,0.05,9,"WA","Ellensburg","PSPL Copa 2 - East U13","",""
