"team .colname","total .colname","attack .colname","defense .colname","n .colname","region .colname","city .colname","fall.league .colname","other .colname"
"Washington Timbers USSDA B04",1643,16.73,20.61,8,"WA","Vancouver","",""
"PCU Red 1 B04",1632,19.82,16.09,37,"OR","Portland","PTT B04 Premier Green",""
"4-H PSG B04",1620,10.4,28.29,29,"OR","","PTT B04 Premier Green",""
"Crossfire Yakima A B04",1595,19.34,12.82,22,"WA","Yakima","RCL B04 Div 1",""
"Spokane Sounders A B04",1549,16.02,11.24,34,"WA","Spokane","RCL B04 Div 1",""
"GS Surf A B04",1533,16.77,9.6,36,"WA","Bothel","RCL B04 Div 1",""
"3 Rivers Black B04",1528,16.01,9.74,28,"WA","Pasco","RCL B04 Div 1",""
"PacNW Maroon B04",1523,17.04,8.83,40,"WA","Tukwila","RCL B04 Div 2",""
"ISC Gunners A Blue B04",1519,15.47,9.45,39,"WA","Issaquah","PSPL WNPL U14",""
"Spokane Pumas B04",1496,14.17,8.76,37,"WA","Spokane","PSPL WNPL U14",""
"NW United Black B04",1486,11.43,10.2,44,"WA","Burlington","RCL B04 Div 1",""
"FPSC Fury Black B04",1483,10.14,11.22,42,"WA","Tacoma","PSPL WNPL U14",""
"Idaho Rush Premier B04",1483,10.14,11.19,19,"ID","Boise","Idaho D3 Div 1 U14",""
"Seattle United Copa B04",1470,11.95,8.69,27,"WA","Seattle","RCL B04 Div 1",""
"NSC Green B04",1456,9.87,9.57,34,"WA","Woodinvile","NPSL DIVISION 1 (04) U14",""
"Wenatchee Valley United Quincy B04",1443,14.06,6.13,27,"WA","Quincy","PSPL WSPL U14",""
"Kent City Red B04",1434,13.95,5.8,14,"WA","Kent","PSPL WNPL U14",""
"FC Nova Gold B04",1426,11.48,6.7,26,"ID","Boise","Idaho D3 Div 1 U14",""
"ETFC Santos Black B04",1422,9.4,7.95,38,"OR","Eugene","PTT B04 Premier White",""
"GPS Oregon B04",1415,10.64,6.66,23,"OR","","PTT B04 Premier Green",""
"Southside SC Azul B04",1405,9.86,6.72,41,"OR","Tigard","PTT B04 Premier Green",""
"Whatcom Rangers Gold B04",1404,9.1,7.21,28,"WA","Bellingham","RCL B04 Div 1",""
"WPFC Black B04",1398,9.75,6.48,43,"WA","Tacoma","RCL B04 Div 1",""
"Irish Black Hawks B04",1398,11.01,5.74,23,"WA","","NPSL DIVISION 1 (04) U14",""
"Crossfire Premier A B04",1395,8.84,7,39,"WA","Redmond","RCL B04 Div 1",""
"Crossfire Select Pombo B04",1389,5.97,9.95,35,"WA","Redmond","NPSL DIVISION 1 (04) U14",""
"Seattle United Tango B04",1377,11.5,4.76,37,"WA","Seattle","RCL B04 Div 2",""
"Eastside FC White B04",1376,7.89,6.88,40,"WA","Preston","RCL B04 Div 2",""
"Academia de Futebol ADF B04",1372,9.19,5.72,29,"OR","Portland","PTT B04 Premier Green",""
"Blackhills FC Black B04",1370,9.94,5.24,33,"WA","Olympia","RCL B04 Div 1",""
"Washington Timbers Red 2 B04",1367,10.39,4.91,34,"WA","Vancouver","PTT B04 Premier White",""
"FWFC Blue B04",1367,10.53,4.84,40,"WA","Federal Way","RCL B04 Div 2",""
"FC Salmon Creek White B04",1355,9.61,4.86,30,"WA","Salmon Creek","PTT B04 Premier Green",""
"Boise Nationals Timbers Blue B04",1346,9.89,4.44,23,"ID","Boise","Idaho D3 Div 1 U14",""
"HSC Munchen B04",1331,6.27,6.31,14,"OR","Hillboro","PTT B04 Premier White",""
"Crossfire Premier B B04",1329,4.74,8.27,45,"WA","Redmond","RCL B04 Div 2",""
"4-H FC Joga B04",1328,7.76,5.02,28,"OR","","PTT B04 Premier Green",""
"TC United Navy B04",1327,8.06,4.78,29,"WA","Lacey","PSPL WSPL U14",""
"FC Edmonds Force B04",1323,8.91,4.2,34,"WA","Edmonds","PSPL WNPL U14",""
"BIFC Blue B04",1316,6.7,5.35,30,"WA","Bainbridge Island","NPSL DIVISION 1 (04) U14",""
"Washington East SC B04",1311,8.97,3.86,26,"WA","Spokane","PSPL WSPL U14",""
"Emerald City FC Green B04",1311,9.05,3.81,33,"WA","Seattle","PSPL WSPL U14",""
"Liga Tlaxtli FC Guerreros B04",1308,5.92,5.73,24,"WA","","",""
"4-H McMinnville United B04",1305,9.83,3.36,12,"OR","","PTT B04 Premier White",""
"PacNW Blue B04",1302,8.71,3.73,40,"WA","Tukwila","RCL B04 Div 3",""
"Washington Timbers White 1 B04",1298,4.61,6.83,31,"WA","Vancouver","PTT B04 Div 1 White",""
"Seattle United W Blue B04",1290,6.47,4.62,33,"WA","Seattle","NPSL DIVISION 1 (04) U14",""
"HSC Arsenal B04",1289,5.37,5.51,14,"OR","Hillboro","",""
"Sting SC Timbers Red B04",1289,5.93,4.99,37,"ID","Coeur D'Alene","PSPL Classic 1 - East U14",""
"Bend FC Timbers Red B04",1283,7.98,3.56,32,"OR","Bend","PTT B04 Premier White",""
"Eclipse FC Aguilitos del America B04",1277,8.52,3.21,26,"WA","","PSPL Classic 1 - West U14",""
"Crossfire Oregon Green I B04",1277,5.79,4.71,33,"OR","Lake Oswego","PTT B04 Premier White",""
"NPSA Titans Navy B04",1276,6.03,4.49,30,"WA","Bellevue","PSPL WNPL U14",""
"Highline SA Rebano B04",1275,6.67,4.04,23,"WA","","NPSL DIVISION 3 (04) U14",""
"Harbor Premier Green B04",1275,7.99,3.36,34,"WA","Gig Harbor","RCL B04 Div 2",""
"Canyon Optimist Inferno B04",1268,7.84,3.26,21,"ID","Caldwell","Idaho D3 Div 1 U14",""
"Hood River Dynamos B04",1253,6.75,3.42,10,"OR","Hood River","PTT B04 Div 1 Green",""
"ISC Gunners A White B04",1249,7.26,3.1,32,"WA","Issaquah","PSPL Classic 1 - West U14",""
"Wenatchee FC Black B04",1242,5.72,3.75,30,"WA","Wenatchee","PSPL Classic 1 - East U14",""
"Seattle Celtic Green B04",1242,7.71,2.77,31,"WA","Seattle","PSPL Classic 1 - West U14",""
"FWFC Alliance B04",1236,2.91,7.07,8,"WA","Federal Way","",""
"3 Rivers Green B04",1234,6.49,3.13,22,"WA","Pasco","RCL B04 Div 4",""
"Westside Timbers Copa B04",1231,6.9,2.88,36,"OR","Beaverton","PTT B04 Div 1 Green",""
"Highline Select B04",1230,4.42,4.44,12,"WA","Burien","",""
"Wenatchee Valley United ML B04",1227,4.89,3.93,10,"WA","Wenatchee","PSPL Classic 1 - East U14",""
"Eastside FC Blue B04",1222,4.64,4.02,33,"WA","Preston","RCL B04 Div 2",""
"Storm King B04",1218,8.05,2.24,17,"WA","Port Angeles","NPSL DIVISION 1 (04) U14",""
"PacNW White B04",1216,6.01,2.97,18,"WA","Tukwila","RCL B04 Div 4",""
"Wenatchee Valley United La Raza B04",1215,6.72,2.65,22,"WA","Quincy","PSPL Classic 1 - East U14",""
"MSC Gold B04",1213,5.21,3.36,8,"ID","","Idaho D3 Div 2 U14",""
"PCU Red 2 B04",1210,5.62,3.06,36,"OR","Portland","PTT B04 Premier White",""
"Slammers Orange B04",1200,5.46,2.92,35,"WA","Auburn","RCL B04 Div 2",""
"Highline SA B04",1198,4.16,3.79,24,"WA","","NPSL DIVISION 1 (04) U14",""
"Crossfire Select Barnes B04",1194,3.98,3.87,30,"WA","Redmond","NPSL DIVISION 1 (04) U14",""
"Pumas UNAM B04",1189,6.26,2.37,35,"WA","Seattle","PSPL Classic 1 - West U14",""
"Emerald City FC White B04",1185,4.02,3.58,26,"WA","Seattle","PSPL Classic 1 - West U14",""
"THUSC Chromium Black B04",1184,3.32,4.32,35,"OR","Beaverton","PTT B04 Premier White",""
"Foothills SC Celtic White B04",1183,5.14,2.78,22,"OR","Portland","PTT B04 Premier White",""
"Seattle United Shoreline Blue B04",1180,6.09,2.29,30,"WA","Shoreline","NPSL DIVISION 1 (04) U14",""
"Capital FC Timbers Red B04",1176,6.48,2.09,25,"OR","Salem","PTT B04 Div 1 Green",""
"LSDSC United Blue B04",1174,3.88,3.43,12,"OR","","NPSL DIVISION 2 (04) U14",""
"NEU White B04",1166,5.05,2.5,30,"OR","Portland","PTT B04 Premier White",""
"STU Evolution Araujo B04",1165,4.58,2.73,12,"WA","Tacoma","SSUL B05 14 Div 2",""
"CSC Storm Navy B04",1163,4.43,2.79,28,"OR","Corvallis","PTT B04 Div 1 White",""
"NK Crew B04",1163,4.96,2.49,33,"WA","Poulsbo","PSPL WSPL U14",""
"CUSC Red B04",1158,5.72,2.09,34,"OR","Clackamas","PTT B04 Div 1 White",""
"NSC Athletico B04",1155,4.01,2.93,29,"WA","Woodinvile","NPSL DIVISION 2 (04) U14",""
"Whatcom Rangers Blue B04",1155,3.89,3.01,34,"WA","Bellingham","RCL B04 Div 3",""
"STU Evolution Truillo B04",1152,4.03,2.85,12,"WA","Tacoma","NPSL DIVISION 1 (04) U14",""
"Nortac Colibri B04",1152,5.45,2.1,26,"WA","Tacoma","NPSL DIVISION 1 (04) U14",""
"NW United Red B04",1146,5.07,2.16,35,"WA","Burlington","RCL B04 Div 3",""
"South Tacoma United Xolos B04",1143,5.12,2.11,9,"WA","Tacoma","",""
"FC Nova Red B04",1135,4.04,2.52,25,"ID","Boise","Idaho D3 Div 2 U14",""
"NPSA Titans White B04",1132,4.99,2.01,27,"WA","Bellevue","PSPL Classic 1 - West U14",""
"Kent United Green B04",1131,4.2,2.37,32,"WA","Kent","NPSL DIVISION 2 (04) U14",""
"Kent City White B04",1131,2.8,3.53,21,"WA","Kent","PSPL Classic 2 - West U14",""
"WPFC White B04",1122,5.67,1.64,38,"WA","Tacoma","RCL B04 Div 3",""
"Central WA SA Navy B04",1121,4.26,2.18,27,"WA","Yakima","PSPL WSPL U14",""
"Idaho Rush Nero B04",1120,4.14,2.21,24,"ID","Boise","Idaho D3 Div 1 U14",""
"Seattle United S Blue B04",1113,4.04,2.17,25,"WA","Seattle","NPSL DIVISION 1 (04) U14",""
"Dragons FC B04",1112,4.32,2.01,28,"WA","Seattle","PSPL Classic 1 - West U14",""
"Kitsap Alliance FC Red B04",1097,2.81,2.79,12,"WA","Silverdale","",""
"Impact FC Black B04",1091,4.09,1.83,36,"WA","Renton","PSPL Classic 1 - West U14",""
"FC Portland Navy B04",1089,3.08,2.4,35,"OR","Portland","PTT B04 Div 1 Green",""
"FWFC White B04",1087,3.87,1.89,33,"WA","Federal Way","RCL B04 Div 4",""
"Walla Walla United B04",1086,3.9,1.86,10,"WA","Walla Walla","PSPL Copa 1 - East U14",""
"SESC Dragons B04",1082,3.55,1.99,34,"OR","Portland","PTT B04 Div 1 White",""
"Boise Nationals Timbers Red B04",1080,2.68,2.59,29,"ID","Boise","Idaho D3 Div 2 U14",""
"ASE Emerald B04",1076,4.32,1.56,10,"WA","Pasco","PSPL Copa 1 - East U14",""
"NC Alliance Red B04",1075,4.5,1.49,28,"WA","","PSPL Classic 1 - West U14",""
"ISC Gunners B B04",1074,4.14,1.62,33,"WA","Issaquah","PSPL Classic 2 - West U14",""
"Eastside Timbers Red B04",1071,3.48,1.88,22,"OR","Gresham","PTT B04 Div 1 Green",""
"WA Rush B04",1061,3.04,2.01,27,"WA","Everett","",""
"NW United White B04",1061,3.88,1.57,30,"WA","Burlington","NPSL DIVISION 3 (04) U14",""
"MVP Rapids Navy B04",1059,2.7,2.22,32,"WA","Maple Valley","PSPL WSPL U14",""
"Bellevue United Select B04",1057,3.25,1.83,15,"WA","Bellevue","NPSL DIVISION 3 (04) U14",""
"BSC Portland Black B04",1057,2.95,2.01,22,"OR","Portland","PTT B04 Div 1 White",""
"North Idaho Inferno B04",1054,2.83,2.06,36,"ID","Post Falls","PSPL Classic 1 - East U14",""
"GS Surf B B04",1052,2.49,2.3,33,"WA","Bothel","RCL B04 Div 3",""
"Cascade FC Green B04",1047,4.6,1.21,27,"WA","North Bend","PSPL Classic 3 - West U14",""
"Eastside FC Grey B04",1044,3.14,1.73,32,"WA","Preston","RCL B04 Div 3",""
"HSC Cosmos B04",1043,3.08,1.75,22,"OR","Hillsboro","PTT B04 Div 2 Green","OYS Founders Cup B04"
"TFA Willamette Gold B04",1036,3.64,1.41,25,"OR","","PTT B04 Div 1 White",""
"Seattle Celtic White B04",1034,3.16,1.6,25,"WA","Seattle","PSPL Classic 2 - West U14",""
"Newport FC B04",1031,2.82,1.76,33,"WA","Bellevue","NPSL DIVISION 2 (04) U14",""
"NC Alliance Navy B04",1027,3.47,1.39,30,"WA","","PSPL Classic 2 - West U14",""
"Crossfire Premier C B04",1025,3.54,1.34,33,"WA","Redmond","RCL B04 Div 3",""
"Hawks SC B04",1022,3.06,1.52,25,"WA","Pullman","PSPL Copa 1 - East U14",""
"Crossfire Yakima B B04",1020,2.78,1.66,26,"WA","Yakima","RCL B04 Div 3",""
"Spokane Pumas B B04",1016,4.04,1.1,20,"WA","Spokane","PSPL Classic 1 - East U14",""
"WUFC Gold B04",1013,2.19,2,24,"OR","","PTT B04 Div 2 Green",""
"Snohomish United Black B04",1012,2.72,1.6,27,"WA","Snohomish","RCL B04 Div 4",""
"UPSC United B04",1011,2.58,1.67,12,"WA","University Place","NPSL DIVISION 2 (04) U14",""
"PCU Black 1 B04",1003,2.76,1.48,38,"OR","Portland","PTT B04 Div 1 White","OYS Founders Cup B04"
"RVSC Timbers White B04",997,3.55,1.1,15,"OR","Medford","PTT B04 Div 1 White",""
"ETFC Santos Red B04",995,3.55,1.09,22,"OR","Eugene","PTT B04 Div 1 White",""
"Shoreline Sportsverrou B04",993,3.68,1.03,10,"WA","Shoreline","PSPL Copa 1 - West U14",""
"Saints Academy South B04",993,2.8,1.36,23,"OR","","PTT B04 Div 2 Green","OYS Founders Cup B04"
"NSC Chaos B04",992,3,1.27,22,"WA","Woodinvile","NPSL DIVISION 2 (04) U14",""
"Spokane Sounders B B04",991,2.62,1.44,25,"WA","Spokane","RCL B04 Div 4",""
"Monroe Cobras FC B04",988,3.86,0.95,31,"WA","Monroe","PSPL Classic 1 - West U14",""
"Gala FC B04",988,3.16,1.16,17,"WA","Marysville","PSPL Classic 3 - West U14",""
"THUSC Chromium Green B04",982,2.06,1.72,33,"OR","Beaverton","PTT B04 Div 1 Green",""
"TC United White B04",973,2.23,1.49,22,"WA","Lacey","PSPL Classic 3 - West U14",""
"Central WA SA White B04",969,3.36,0.96,13,"WA","Yakima","PSPL Classic 1 - East U14",""
"Washington East SC B B04",966,3.17,1,17,"WA","Spokane","PSPL Copa 1 - East U14",""
"WP Markquart B04",961,2.41,1.27,14,"WA","","SSUL B05 14 Div 2",""
"Breakers Red B04",959,2.47,1.22,28,"WA","Spokane","PSPL Classic 1 - East U14",""
"LWPFC White Sharks B04",955,2.39,1.22,35,"WA","Redmond","PSPL Classic 2 - West U14",""
"Endeavor SA Red B04",955,2.29,1.28,25,"WA","","PSPL Classic 1 - East U14",""
"NEU Blue B04",954,1.99,1.46,22,"OR","Portland","PTT B04 Div 1 Green","OYS Founders Cup B04"
"Normandy Park FC White B04",953,3.02,0.96,21,"WA","Normandy Park","PSPL Classic 1 - West U14",""
"Bend FC Timbers White B04",945,2.72,1,25,"OR","Bend","PTT B04 Div 2 White",""
"Oregon Futbol Academy Blue B04",941,1.41,1.88,14,"OR","","PTT B04 Div 1 Green",""
"Thelo Magistas B04",940,2.75,0.96,24,"OR","Milwaukie","PTT B04 Div 2 White",""
"Westside Timbers Copa TS B04",935,2.17,1.18,37,"OR","Beaverton","PTT B04 Div 2 Green","OYS Founders Cup B04"
"3 Rivers White B04",930,2.06,1.2,22,"WA","Pasco","PSPL Classic 1 - East U14",""
"ISC Gunners C B04",930,2.26,1.09,35,"WA","Issaquah","PSPL Classic 3 - West U14",""
"Whatcom Rangers White B04",921,1.94,1.19,27,"WA","Bellingham","NPSL DIVISION 2 (04) U14",""
"Sandpoint Strikers B04",916,2.13,1.05,16,"ID","Sandpoint","",""
"Pacific FC Dynamo B04",916,2.06,1.08,28,"WA","Battle Ground","PTT B04 Div 2 Green",""
"Foothills SC Celtic Green B04",915,2.2,1,27,"OR","Portland","PTT B04 Div 2 White","OYS Founders Cup B04"
"Spokane Scotties Wilmot B04",912,2.72,0.8,21,"WA","Spokane","PSPL Copa 1 - East U14",""
"Southlake Select Red B04",909,2.18,0.98,12,"WA","Newcastle","SSUL B05 14 Div 2",""
"Seattle Celtic Orange B04",906,1.8,1.16,24,"WA","Seattle","PSPL Copa 1 - West U14",""
"Blackhills FC Red B04",900,2.1,0.96,26,"WA","Olympia","RCL B04 Div 4",""
"Saints Academy North B04",899,2.6,0.76,22,"OR","","PTT B04 Div 2 White","OYS Founders Cup B04"
"BSC Portland Gold B04",894,2.38,0.81,22,"OR","Portland","PTT B04 Div 2 White",""
"Crossfire Select Barton B04",893,2.25,0.85,24,"WA","Redmond","NPSL DIVISION 2 (04) U14",""
"PVSC United Fury B04",893,2.31,0.82,9,"ID","Pocatello","",""
"Academia Leon B04",886,2.5,0.73,18,"OR","Beaverton","","OYS Founders Cup B04"
"LOSC Green I B04",878,1.69,1.02,25,"OR","Lake Oswego","PTT B04 Div 2 Green","OYS Founders Cup B04"
"New Millenium FC Furia Azul B04",876,1.91,0.89,18,"WA","Burlington","PSPL Copa 1 - West U14",""
"FC Portland White B04",875,1.85,0.91,21,"OR","Portland","PTT B04 Div 2 Green",""
"NSC Voltage Black B04",874,2.05,0.82,17,"WA","Woodinvile","NPSL DIVISION 3 (04) U14",""
"FWFC Select B04",866,1.34,1.18,21,"WA","Federal Way","NPSL DIVISION 3 (04) U14",""
"WS Red Bulls B04",863,1.4,1.1,19,"WA","West Seattle","NPSL DIVISION 2 (04) U14",""
"Lake Hills Tigers B04",861,1.77,0.86,23,"WA","Bellevue","NPSL DIVISION 3 (04) U14",""
"Irish Lions B04",860,2.26,0.67,14,"WA","Mukilteo","NPSL DIVISION 3 (04) U14",""
"FC Bellevue B04",851,2.08,0.69,14,"WA","Mercer Island","PSPL Classic 2 - West U14",""
"FWFC Sharks B04",851,2.02,0.7,11,"WA","Federal Way","SSUL B05 14 Div 2",""
"YCSC B04",840,1.55,0.85,10,"OR","","PTT B04 Div 2 White",""
"South Kitsap United B04",838,1.31,0.99,13,"WA","Port Orchard","PSPL Copa 1 - West U14",""
"Santos FC Angeles B04",827,1.37,0.88,10,"OR","Forest Grove","PTT B04 Div 1 White",""
"FME Xtreme B04",826,1.53,0.79,23,"WA","Milton","NPSL DIVISION 3 (04) U14",""
"IEYSA Storm B04",821,1.61,0.72,18,"WA","Cheney","PSPL Copa 1 - East U14",""
"Seattle United W White B04",809,1.49,0.72,20,"WA","Seattle","NPSL DIVISION 2 (04) U14",""
"PCU Black 2 B04",801,1.47,0.68,21,"OR","Portland","PTT B04 Div 2 White","OYS Founders Cup B04"
"West Narrows Blue B04",794,1.69,0.57,13,"WA","Gig Harbor","PSPL Copa 1 - West U14",""
"Oregon Trail SC Strikers B04",785,1.74,0.52,20,"OR","","PTT B04 Div 2 White",""
"Eagleclaw FA Blue Hawks B04",771,1.3,0.63,21,"WA","Seattle","PSPL Copa 1 - West U14",""
"WUFC White B04",763,0.77,1,12,"OR","","PTT B04 Div 2 White","OYS Founders Cup B04"
"Endeavor SA B04",760,1.3,0.59,10,"WA","","PSPL Copa 1 - East U14",""
"NEU Silver B04",754,1.16,0.63,13,"OR","Portland","PTT B04 Div 2 White","OYS Founders Cup B04"
"Nortac Sparta Red B04",750,1.44,0.49,21,"WA","Tacoma","PSPL Classic 3 - West U14",""
"LYS Red Knights B04",735,0.95,0.67,17,"OR","","PTT B04 Div 2 White",""
"FWFC Black B04",732,0.97,0.64,15,"WA","Federal Way","RCL B04 Div 4",""
"Emerald City FC Blue B04",726,1.12,0.53,18,"WA","Seattle","PSPL Copa 1 - West U14",""
"Washington Timbers White 2 B04",705,0.72,0.72,22,"WA","Vancouver","PTT B04 Div 2 White","OYS Founders Cup B04"
"WA Rush Nero B04",694,0.6,0.8,22,"WA","Everett","",""
"BIFC White B04",662,0.78,0.49,21,"WA","Bainbridge Island","NPSL DIVISION 3 (04) U14",""
"Seattle Celtic Black B04",661,0.86,0.44,10,"WA","Seattle","PSPL Copa 1 - West U14",""
"GPS Newberg B04",650,1.01,0.35,18,"OR","","PTT B04 Div 2 Green",""
"Westside Timbers Samba B04",647,0.58,0.6,20,"OR","Beaverton","PTT B04 Div 2 Green","OYS Founders Cup B04"
"Impact FC White B04",635,0.81,0.39,25,"WA","Renton","PSPL Copa 1 - West U14",""
"IFC Red B04",585,0.34,0.66,19,"WA","Issaquah","NPSL DIVISION 3 (04) U14",""
